{
    "description": "Configuration optimisée USDCAD avec flexibilité adaptative",
    "symbol": "USDCAD",
    "type": "forex",
    "profile": "institutionnel",
    "last_updated": "2025-09-10",
    "volatility": {
        "expected_daily_range_percent": {
            "value": 0.6,
            "adaptive_range": {
                "min": 0.4,
                "max": 0.9,
                "adjustment_period_days": 7
            }
        },
        "max_allowed_spread_points": {
            "base": 10,
            "session_multipliers": {
                "london_ny": 1.0,
                "asian": 1.2,
                "weekend": 1.5
            },
            "news_spike_tolerance": 18,
            "volatility_adjustment": true
        },
        "min_tradable_range_points": {
            "value": 8,
            "dynamic_adjustment": true
        }
    },
    "risk_management": {
        "base_lot_size": 1.0,
        "daily_loss_limit_percent": {
            "base": 2.0,
            "aggressive_mode": 2.5,
            "conservative_mode": 1.5,
            "dynamic_adjustment": true
        },
        "weekly_loss_limit_percent": {
            "base": 5.0,
            "max_escalation": 6.0
        },
        "performance_based_adjustments": {
            "winning_streak_bonus": 0.2,
            "losing_streak_reduction": 0.3,
            "streak_threshold": 3
        }
    },
    "strategy_toggles": {
        "enable_scalping_mode": {
            "value": true,
            "time_conditions": [
                "07:00-09:00",
                "13:00-16:00"
            ],
            "volatility_threshold": 0.5
        },
        "enable_trailing_stop": {
            "value": true,
            "minimum_profit_threshold": 0.3
        },
        "enable_grid_in_range_only": true,
        "auto_blacklist_high_spread_assets": {
            "value": true,
            "threshold_multiplier": 2.0,
            "blacklist_duration_minutes": 15
        },
        "scalping": {
            "bollinger_midline_gate": {
                "enabled": true,
                "require_range_regime": true,
                "block_on_expansion": true,
                "entry_gate_ok_required": true,
                "min_mid_distance_ratio": 0.10
            },
            "liquidity_sweep": {
                "lookback_bars": 20
            },
            "execution": {
                "min_sl_tp_distance_pips": 8
            },
            "trailing_stop": {
                "enabled": true,
                "distance_pips": 5.0
            },
            "risk_filters": {
                "cooldown": {
                    "enabled": true,
                    "mode": "bars",
                    "min_bars_between_trades": 5,
                    "min_cycles_between_trades": 0
                },
                "adaptive_lot_sizing": {
                    "enabled": true,
                    "based_on_volatility": true,
                    "based_on_account_performance": true
                }
            },
            "smart_targets": {
                "take_profit_multiplier": {
                    "base": 1.2,
                    "range_market": 1.0,
                    "trending_market": 1.6,
                    "high_volatility": 1.8
                },
                "stop_loss_multiplier": 1.0,
                "trailing_stop_start_after_percent": {
                    "base": 0.4,
                    "adaptive": true,
                    "high_volatility": 0.6
                },
                "trailing_step_points": {
                    "base": 5,
                    "adaptive_to_atr": true,
                    "minimum": 3,
                    "maximum": 12
                }
            },
            "trade_frequency": {
                "enabled": true,
                "min_bars_between_trades": 3
            }
        }
    }
}